{
  "schema_version": "1.0.0",
  "catalog_id": "terraflux-sugarcane-reference-model-catalog",
  "as_of": "2026-08-24",
  "purpose": "Biblioteca selecionavel de referencias reais, dados oficiais, metodos, equipamentos OEM, priors E0 e templates fail-closed para projetos de sistematizacao de cana-de-acucar.",
  "market_claim_policy": {
    "rules": [
      "market_common_requires_an_explicit_census_or_publication",
      "major_oem_examples_are_not_market_share_rankings",
      "a_popular_variety_is_not_an_agronomic_recommendation_for_a_zone",
      "oem_nominal_data_does_not_replace_the_measured_complete_machine_configuration",
      "public_data_and_field_study_priors_are_screening_inputs_only",
      "every_system_value_can_be_replaced_by_a_traceable_project_value",
      "no_reference_model_resolves_project_evidence_or_professional_approval"
    ]
  },
  "source_registry": [
    {
      "id": "TF_PARAMETER_CATALOG_1.2",
      "title": "Catalogo de parametros do projeto TerraFlux 1.2.0",
      "publisher": "TerraFlux project",
      "source_kind": "SYSTEM_CONTRACT",
      "url": "config/catalogo_parametros_projeto.json",
      "published_at": "2026-08-24",
      "checked_at": "2026-08-24",
      "locators": ["default_policy", "parameters"],
      "limitations": ["Contrato de produto; nao e uma recomendacao agronomica ou norma externa."]
    },
    {
      "id": "TF_ACQUISITION_CATALOG_1.0",
      "title": "Catalogo de aquisicao de insumos TerraFlux 1.0.0",
      "publisher": "TerraFlux project",
      "source_kind": "SYSTEM_CONTRACT",
      "url": "config/catalogo_aquisicao_insumos.json",
      "published_at": "2026-08-24",
      "checked_at": "2026-08-24",
      "locators": ["evidence_packages", "data_contract", "absence_policy"],
      "limitations": ["Define como obter evidencia; nao fornece valores locais da fazenda."]
    },
    {
      "id": "IAC_BT216_2016",
      "title": "Recomendacoes gerais para a conservacao do solo na cultura da cana-de-acucar",
      "publisher": "Instituto Agronomico de Campinas",
      "source_kind": "OFFICIAL_METHOD",
      "url": "https://www.iac.sp.gov.br/media/publicacoes/iacbt126.pdf",
      "published_at": "2016",
      "checked_at": "2026-08-24",
      "locators": ["Boletim Tecnico 216", "secao 4.5", "quadros 6 a 10", "paginas 37 e 81 do documento"],
      "limitations": ["Aplicacao numerica depende do solo, uso, manejo, declive, chuva e validacao profissional; vigencia regional deve ser confirmada."]
    },
    {
      "id": "IAC_DOC109_2012",
      "title": "Sistema de multiplicacao de cana-de-acucar com mudas pre-brotadas",
      "publisher": "Instituto Agronomico de Campinas",
      "source_kind": "OFFICIAL_METHOD",
      "url": "https://www.iac.sp.gov.br/publicacoes/publicacoes/iacdoc109.pdf",
      "published_at": "2012",
      "checked_at": "2026-08-24",
      "locators": ["secao de plantio", "espacamentos simples de 1,5 m e combinado de 1,5 m por 0,90 m"],
      "limitations": ["Documento de MPB; o arranjo deve ser conciliado com variedade, solo, frota e sistema de colheita."]
    },
    {
      "id": "IAC_BT245_2025",
      "title": "Censo varietal IAC de cana-de-acucar no Brasil - safra 2024/25",
      "publisher": "Instituto Agronomico de Campinas",
      "source_kind": "OFFICIAL_MARKET_CENSUS",
      "url": "https://www.iac.sp.gov.br/media/publicacoes/iacbt245.pdf",
      "published_at": "2025",
      "checked_at": "2026-08-24",
      "locators": ["tabela 1", "tabela 10", "regiao Centro-Sul"],
      "limitations": ["Retrato de adocao, nao recomendacao de variedade; a participacao muda por safra e regiao."]
    },
    {
      "id": "EMBRAPA_CANA_PLANTIO",
      "title": "Plantio de cana-de-acucar",
      "publisher": "Embrapa",
      "source_kind": "OFFICIAL_METHOD",
      "url": "https://www.embrapa.br/en/web/agencia-de-informacao-tecnologica/cultivos/cana-de-acucar/producao/manejo/plantio",
      "published_at": "updated 2022",
      "checked_at": "2026-08-24",
      "locators": ["espacamento entre sulcos", "colheita mecanizada", "espacamento uniforme e combinado"],
      "limitations": ["Faixas gerais; nao substituem posicionamento agronomico por ambiente de producao."]
    },
    {
      "id": "CONAB_CANA_2026_27_2LEV",
      "title": "Segundo levantamento da safra de cana-de-acucar 2026/27",
      "publisher": "Companhia Nacional de Abastecimento",
      "source_kind": "OFFICIAL_DATA",
      "url": "https://www.gov.br/conab/pt-br/atuacao/informacoes-agropecuarias/safras/safra-de-cana-de-acucar/arquivos-boletins/2o-levantamento-safra-2026-27/2o-levantamento-safra-2026-27",
      "published_at": "2026-08-20",
      "checked_at": "2026-08-24",
      "locators": ["produtividade nacional 77.905 kg/ha", "Sudeste 80.872 kg/ha", "Centro-Oeste 78.755 kg/ha", "Nordeste 60.037 kg/ha"],
      "limitations": ["Estimativa regional e temporal; nao representa a produtividade de um talhao ou variedade especifica."]
    },
    {
      "id": "ANA_PPA_V5_2025",
      "title": "Programa Produtor de Agua, volume 5 - praticas mecanicas",
      "publisher": "Agencia Nacional de Aguas e Saneamento Basico",
      "source_kind": "OFFICIAL_METHOD",
      "url": "https://www.gov.br/ana/pt-br/acesso-a-informacao/acoes-e-programas/programa-produtor-de-agua/manuais-e-capacitacao/manuais/manual-programa-produtor-de-agua-volume-5",
      "published_at": "2025-12-02",
      "checked_at": "2026-08-24",
      "locators": ["terraceamento", "escoamento superficial difuso", "estradas rurais", "praticas mecanicas"],
      "limitations": ["Metodo nacional de processo; nao fornece um conjunto numerico universal para cada fazenda."]
    },
    {
      "id": "SGB_IDF_2023",
      "title": "Atlas pluviometrico do Brasil - equacoes IDF definidas em 2023",
      "publisher": "Servico Geologico do Brasil",
      "source_kind": "OFFICIAL_DATA",
      "url": "https://rigeo.sgb.gov.br/items/ca0aefe1-91de-48b4-8810-b8517907ceb1",
      "published_at": "2023",
      "checked_at": "2026-08-24",
      "locators": ["equacoes intensidade-duracao-frequencia", "estacoes com registros continuos e desagregados"],
      "limitations": ["A escolha de estacao, extrapolacao, periodo de retorno, duracao e hietograma requer justificativa e aprovacao."]
    },
    {
      "id": "ANA_HYDROWEB",
      "title": "Orientacoes e manuais de dados hidrologicos HydroWeb",
      "publisher": "Agencia Nacional de Aguas e Saneamento Basico",
      "source_kind": "OFFICIAL_DATA",
      "url": "https://www.gov.br/ana/pt-br/assuntos/monitoramento-e-eventos-criticos/monitoramento-hidrologico/orientacoes-manuais/manuais-de-sistemas-e-servicos-de-disponibilizacao-de-dados-hidrologicos",
      "published_at": "current service",
      "checked_at": "2026-08-24",
      "locators": ["series hidrologicas", "servicos de disponibilizacao"],
      "limitations": ["Serie publica precisa de controle de qualidade, completude e representatividade espacial."]
    },
    {
      "id": "ANA_BHO6_2024",
      "title": "Base Hidrografica Ottocodificada Multiescalas versao 6",
      "publisher": "Agencia Nacional de Aguas e Saneamento Basico",
      "source_kind": "OFFICIAL_DATA",
      "url": "https://www.gov.br/ana/pt-br/assuntos/noticias-e-eventos/noticias/base-de-dados-geoespaciais-da-ana-permite-gestao-mais-eficiente-das-bacias-hidrograficas/",
      "published_at": "2024-10-01",
      "checked_at": "2026-08-24",
      "locators": ["BHO6", "cobertura nacional", "escala igual ou melhor que 1:250.000"],
      "limitations": ["Serve ao contexto regional; nao substitui o fechamento de microdrenagem e estruturas levantadas em campo."]
    },
    {
      "id": "INMET_BDMEP",
      "title": "BDMEP - dados historicos meteorologicos",
      "publisher": "Instituto Nacional de Meteorologia",
      "source_kind": "OFFICIAL_DATA",
      "url": "https://portal.inmet.gov.br/servicos/bdmep-dados-historicos",
      "published_at": "current service",
      "checked_at": "2026-08-24",
      "locators": ["dados historicos diarios", "estacoes convencionais e automaticas"],
      "limitations": ["Dado diario ou bruto nao gera sozinho um evento sub-horario de projeto."]
    },
    {
      "id": "IBGE_HGEOHNOR2020",
      "title": "hgeoHNOR2020 - conversao entre altitudes GNSS e data verticais",
      "publisher": "Instituto Brasileiro de Geografia e Estatistica",
      "source_kind": "OFFICIAL_METHOD",
      "url": "https://www.ibge.gov.br/geociencias/modelos-digitais-de-superficie/modelos-digitais-de-superficie/31283-hgeohnor2020-modeloconversaoaltitudesgeometricasgnss-datumverticalsgb.html",
      "published_at": "2020",
      "checked_at": "2026-08-24",
      "locators": ["REALT2018", "conversao de altitudes geometricas"],
      "limitations": ["Conversao nao comprova a acuracia local nem substitui checkpoints independentes."]
    },
    {
      "id": "IBGE_PEDOLOGIA_250K",
      "title": "Pedologia 1:250.000",
      "publisher": "Instituto Brasileiro de Geografia e Estatistica",
      "source_kind": "OFFICIAL_DATA",
      "url": "https://www.ibge.gov.br/geociencias/informacoes-ambientais/pedologia/10871-pedologia.html",
      "published_at": "version 2023",
      "checked_at": "2026-08-24",
      "locators": ["base espacial 1:250.000", "pedo_area e pedo_ponto"],
      "limitations": ["Escala regional; nao determina grupo hidrologico, Ksat ou erodibilidade executiva de um talhao."]
    },
    {
      "id": "EMBRAPA_PRONASOLOS",
      "title": "Portal de dados da plataforma PronaSolos",
      "publisher": "Embrapa Solos",
      "source_kind": "OFFICIAL_DATA",
      "url": "https://www.embrapa.br/en/busca-de-solucoes-tecnologicas/-/produto-servico/9076/portal-de-dados-da-plataforma-tecnologica-pronasolos-em-ambiente-sigweb",
      "published_at": "current portal",
      "checked_at": "2026-08-24",
      "locators": ["SIGWeb", "dados de solos"],
      "limitations": ["Prior de estratificacao; requer perfil, laboratorio e ensaio hidraulico local."]
    },
    {